{
  "manifest_version": 2,
  "id": "notemd.next",
  "name": "Next",
  "version": "1.6.5",
  "kind": "native",
  "engines": {
    "notemd": ">=6.901.1"
  },
  "description": "Give ideas and tasks a clear next step — or a place to rest.",
  "ui": "ui/",
  "activation": {
    "events": [
      "onCommand:open"
    ]
  },
  "contributes": {
    "menus": [
      {
        "location": "plugins",
        "submenu": "advance",
        "label": "Next",
        "command": "open"
      }
    ],
    "windows": [
      {
        "id": "main",
        "entry": "index.html",
        "title": "Next",
        "width": 1240,
        "height": 760,
        "min_width": 720,
        "min_height": 520,
        "open_command": "open"
      }
    ],
    "tray": [
      {
        "window": "main",
        "section": "capture",
        "accelerator": "Cmd+Ctrl+N"
      }
    ]
  },
  "capabilities": [
    "vault.read",
    "vault.write",
    "editor.open",
    "toast",
    "settings"
  ],
  "i18n": {
    "zh": {
      "name": "下一步",
      "description": "让想法和任务都有明确的下一步，或一个安心搁置的地方。",
      "menus": {
        "open": "下一步"
      }
    },
    "ja": {
      "name": "次の一歩",
      "description": "アイデアとタスクに明確な次の一歩を与えるか、安心して休ませる場所を用意します。",
      "menus": {
        "open": "次の一歩"
      }
    },
    "de": {
      "name": "Nächster Schritt",
      "description": "Ideen und Aufgaben einen klaren nächsten Schritt geben – oder einen guten Ort zum Ruhen.",
      "menus": {
        "open": "Nächster Schritt"
      }
    }
  }
}
